{
  "version": "0.1.0",
  "published_at": "2026-10-15T00:00:00Z",
  "release": {
    "kind": "github_release",
    "repository": "DirtyPlayBoy/OrionPlugins",
    "tag": "examples-v0.2.0"
  },
  "staging": false,
  "download_url": "https://github.com/DirtyPlayBoy/OrionPlugins/releases/download/examples-v0.2.0/password-generator-0.1.0-windows-x64.orionplugin",
  "sha256": "77dc50f6b97e1796857a7aca7aee4ced23d2d971feff0bd930326def00561a88",
  "artifacts": [
    {
      "platform": "windows-x64",
      "url": "https://github.com/DirtyPlayBoy/OrionPlugins/releases/download/examples-v0.2.0/password-generator-0.1.0-windows-x64.orionplugin",
      "sha256": "77dc50f6b97e1796857a7aca7aee4ced23d2d971feff0bd930326def00561a88"
    }
  ]
}
