{
  "version": "0.1.0",
  "published_at": "2026-10-15T00:00:00Z",
  "release": {
    "kind": "github_release",
    "repository": "DirtyPlayBoy/OrionPlugins",
    "tag": "examples-v0.1.0"
  },
  "staging": false,
  "download_url": "https://github.com/DirtyPlayBoy/OrionPlugins/releases/download/examples-v0.1.0/hello-orion-0.1.0-windows-x64.orionplugin",
  "sha256": "35a6e44c4f19fa1db96b9758a44324de7f4e82a92cd1b3f0dca339751e0f41cc",
  "artifacts": [
    {
      "platform": "windows-x64",
      "url": "https://github.com/DirtyPlayBoy/OrionPlugins/releases/download/examples-v0.1.0/hello-orion-0.1.0-windows-x64.orionplugin",
      "sha256": "35a6e44c4f19fa1db96b9758a44324de7f4e82a92cd1b3f0dca339751e0f41cc"
    }
  ]
}
